{
  "canonicalRecordCount": 13,
  "capabilitySummary": {
    "CLOSED_OUTCOME": 1,
    "FEES": 1,
    "INITIAL_EXPOSURE": 1,
    "MAX_EXPOSURE": 1,
    "POSITION_INCREASES": 1,
    "POSITION_MODE_OBSERVED_COMPATIBLE": 1,
    "POSITION_MODE_USER_DECLARED": 1,
    "VENUE_POSITION_SUMMARY": 1,
    "VENUE_REPORTED_PNL": 1
  },
  "conflictCount": 0,
  "duplicateCount": 0,
  "eligibleEpisodeCount": 1,
  "episodeCount": 1,
  "excludedEpisodeCount": 0,
  "exclusionReasonCounts": {},
  "fixtureId": "increase-and-reduce",
  "importStatus": "ACCEPTED",
  "parsedRowCount": {
    "POSITION_HISTORY": 1,
    "TRADE_HISTORY": 4
  },
  "sourceRowCount": {
    "POSITION_HISTORY": 1,
    "TRADE_HISTORY": 4
  },
  "versions": {
    "import": "BINANCE_USDS_DUAL_ARTIFACT_IMPORT_V1",
    "normalizer": "fixture-v1",
    "reconciliation": "BINANCE_USDS_LINEAR_PERPETUAL_ONE_WAY_V1",
    "reconstruction": "BINANCE_USDS_LINEAR_PERPETUAL_ONE_WAY_V1"
  },
  "warnings": []
}
