{
  "canonicalRecordCount": 0,
  "capabilitySummary": {},
  "conflictCount": 0,
  "duplicateCount": 0,
  "eligibleEpisodeCount": 0,
  "episodeCount": 0,
  "excludedEpisodeCount": 0,
  "exclusionReasonCounts": {},
  "fixtureId": "unsupported-coin-m",
  "importStatus": "REJECTED",
  "parsedRowCount": {
    "POSITION_HISTORY": 1,
    "TRADE_HISTORY": 2
  },
  "sourceRowCount": {
    "POSITION_HISTORY": 1,
    "TRADE_HISTORY": 2
  },
  "versions": {
    "import": "BINANCE_USDS_DUAL_ARTIFACT_IMPORT_V1",
    "normalizer": "fixture-v1",
    "reconciliation": "BINANCE_USDS_LINEAR_PERPETUAL_ONE_WAY_V1",
    "reconstruction": "BINANCE_USDS_LINEAR_PERPETUAL_ONE_WAY_V1"
  },
  "warnings": []
}
